{
  "chat_id": "chat-1",
  "proposal_id": "proposal-1",
  "module": "problem",
  "chat_status": "waiting_for_user",
  "turns": [
    {
      "turn_id": "turn-1",
      "chat_id": "chat-1",
      "proposal_id": "proposal-1",
      "module": "problem",
      "turn_seq": 1,
      "question_text": "What evidence shows this delay happens often enough to prioritize?",
      "turn_status": "awaiting_user",
      "diagnosis": [
        "Evidence is not specific enough yet."
      ],
      "source_refs": [],
      "gap_refs": [
        "gap-1"
      ],
      "audit_refs": [
        {
          "kind": "agent_run",
          "id": "run-1"
        }
      ],
      "warnings": [],
      "created_at": "2026-05-24T14:10:00.000Z"
    }
  ],
  "active_turn_id": "turn-1",
  "started_at": "2026-05-24T14:10:00.000Z",
  "warnings": []
}
